{
  "schema_version": "0.1.0",
  "member_key": "structural.event_recorded@0.1.0",
  "event_type": "structural.event_recorded",
  "event_version": "0.1.0",
  "payload_contract": {
    "event_envelope_schema_ref": {
      "schema_member_key": "urn:odeya:schema:research-event:0.5.0@0.5.0",
      "schema_id": "urn:odeya:schema:research-event:0.5.0",
      "semantic_version": "0.5.0",
      "byte_digest": "sha256:2222222222222222222222222222222222222222222222222222222222222222",
      "byte_count": 65536,
      "dialect": "https://json-schema.org/draft/2020-12/schema",
      "root_json_type": "object",
      "schema_member_digest": "sha256:3333333333333333333333333333333333333333333333333333333333333333"
    },
    "payload_json_pointer": "/$defs/structural_event_recorded_payload",
    "payload_required": true,
    "nullable": false,
    "exact_branch_required": true
  },
  "aggregate_owner": {
    "owning_module": "structural-module",
    "aggregate_type": "structural-aggregate",
    "ownership_cardinality": "exactly_one"
  },
  "producer_commands": [
    {
      "command_type": "structural.command_probe",
      "command_version": "0.1.0",
      "reference_kind": "logical_reverse_reference",
      "resolution_requirement": "future_same_root_exact_member"
    }
  ],
  "retention_and_privacy": {
    "retention_class": "scientific_record",
    "minimum_retention": "mission_plus_policy",
    "legal_hold_overrides_destruction": true,
    "privacy_class": "restricted",
    "payload_logging": "redacted_canonical",
    "projection_redaction_required": true
  },
  "canonical_reducer_ref": {
    "aggregate_type": "structural-aggregate",
    "reducer_id": "reducer.structural-aggregate",
    "reducer_version": "0.1.0",
    "reducer_member_digest": "sha256:5555555555555555555555555555555555555555555555555555555555555555"
  },
  "trace_refs": [
    {
      "artifact_id": "trace.event.structural-probe",
      "digest": "sha256:6666666666666666666666666666666666666666666666666666666666666666",
      "media_type": "application/json"
    }
  ],
  "review_evidence_refs": [
    {
      "artifact_id": "review.event.structural-probe",
      "digest": "sha256:7777777777777777777777777777777777777777777777777777777777777777",
      "media_type": "application/json"
    }
  ],
  "member_digest_contract": {
    "algorithm": "sha-256",
    "domain_separator": "odeya-event-contract-record-v1",
    "canonicalization_profile_ref": {
      "profile_id": "urn:odeya:canonicalization:odeya-jcs-0.2",
      "profile_version": "0.2.0",
      "profile_core_schema_id": "urn:odeya:schema:canonicalization-profile-core:0.6.0",
      "profile_core_raw_digest": "sha256:1111111111111111111111111111111111111111111111111111111111111111"
    },
    "subject_schema_ref": {
      "schema_id": "urn:odeya:schema:event-contract-record:0.1.0",
      "schema_digest": "sha256:6666666666666666666666666666666666666666666666666666666666666666"
    },
    "included_json_pointers": [
      "/schema_version",
      "/member_key",
      "/event_type",
      "/event_version",
      "/payload_contract",
      "/aggregate_owner",
      "/producer_commands",
      "/retention_and_privacy",
      "/canonical_reducer_ref",
      "/member_digest_contract"
    ],
    "excluded_json_pointers": [
      "/trace_refs",
      "/review_evidence_refs",
      "/member_digest"
    ]
  },
  "member_digest": "sha256:dddddddddddddddddddddddddddddddddddddddddddddddddddddddddddddddd"
}
